{"profile":"default","runtime_generation":"runtime-20260803-01","acked_message_id":"66666666-6666-4666-8666-666666666666","acked_payload_digest":"aaaaaaaaaaaaaaaaaaaaaaaaaaaaaaaaaaaaaaaaaaaaaaaaaaaaaaaaaaaaaaaa","acked_connector_sequence":17,"ack_kind":"snapshot_committed","snapshot_id":"11111111-1111-4111-8111-111111111111","catalog_revision":7,"page_index":0,"is_last":true}
